{
  "schema_version": "0.3.0",
  "request_id": "motor-start",
  "network_file": "network.json",
  "motor": {
    "motor_id": "motor-1",
    "bus_id": "motor_bus",
    "shaft_rated_kw": 30,
    "efficiency": 0.9,
    "rated_power_factor": 0.85,
    "rated_voltage_kv": 0.4,
    "locked_rotor_current_ratio": 6,
    "locked_rotor_power_factor": 0.3
  },
  "dip_limit_percent": 15,
  "tolerance_mva": 1e-10,
  "max_iterations": 100
}
